{
  "schemaVersion": 1,
  "generatedAt": "2026-08-28T00:00:00+00:00",
  "asOf": "2026-08-28",
  "device": {
    "name": "Forerunner 255 Music",
    "firmware": "28.05"
  },
  "features": {
    "vo2max": { "support": "observed", "probeStatus": "ok", "samples": 39, "firstSampleAt": "2025-08-19", "lastSampleAt": "2026-08-19" },
    "fitnessAge": { "support": "observed", "probeStatus": "ok", "samples": 1, "lastSampleAt": "2026-08-20" },
    "achievableFitnessAge": { "support": "observed", "probeStatus": "ok", "samples": 1, "lastSampleAt": "2026-08-20" },
    "bmi": { "support": "observed", "probeStatus": "ok", "samples": 1, "lastSampleAt": "2026-08-20" },
    "weight": { "support": "observed", "probeStatus": "ok", "samples": 1 },
    "height": { "support": "observed", "probeStatus": "ok", "samples": 1 },
    "heartRateZones": { "support": "observed", "probeStatus": "ok", "samples": 5 },
    "activityHeartRateZones": { "support": "observed", "probeStatus": "ok", "samples": 20, "firstSampleAt": "2026-07-18", "lastSampleAt": "2026-08-19" },
    "restingHeartRate": { "support": "observed", "probeStatus": "ok", "samples": 1 },
    "maxHeartRate": { "support": "observed", "probeStatus": "ok", "samples": 1 },
    "lactateThresholdHeartRate": { "support": "observed", "probeStatus": "ok", "samples": 31, "firstSampleAt": "2025-09-01", "lastSampleAt": "2026-07-14" },
    "thresholdPace": { "support": "observed", "probeStatus": "ok", "samples": 31, "firstSampleAt": "2025-09-01", "lastSampleAt": "2026-07-14" },
    "racePredictions": { "support": "observed", "probeStatus": "ok", "samples": 120, "firstSampleAt": "2026-05-01", "lastSampleAt": "2026-08-28" },
    "trainingStatus": { "support": "observed", "probeStatus": "ok", "samples": 28, "firstSampleAt": "2026-08-01", "lastSampleAt": "2026-08-28" },
    "trainingStatusWeekly": { "support": "observed", "probeStatus": "ok", "samples": 26, "firstSampleAt": "2026-03-01", "lastSampleAt": "2026-08-28" },
    "acuteTrainingLoad": { "support": "observed", "probeStatus": "ok", "samples": 28, "firstSampleAt": "2026-08-01", "lastSampleAt": "2026-08-28" },
    "chronicTrainingLoad": { "support": "observed", "probeStatus": "ok", "samples": 28, "firstSampleAt": "2026-08-01", "lastSampleAt": "2026-08-28" },
    "acwr": { "support": "observed", "probeStatus": "ok", "samples": 28, "firstSampleAt": "2026-08-01", "lastSampleAt": "2026-08-28" },
    "trainingLoadBalance": { "support": "observed", "probeStatus": "ok", "samples": 1, "lastSampleAt": "2026-08-28" },
    "activeGear": { "support": "observed", "probeStatus": "ok", "samples": 3 },
    "retiredGear": { "support": "observed", "probeStatus": "ok", "samples": 1 },
    "trainingPlan": { "support": "observed", "probeStatus": "ok", "samples": 1 },
    "plannedWorkouts": { "support": "observed", "probeStatus": "ok", "samples": 18, "firstSampleAt": "2026-08-01", "lastSampleAt": "2026-11-28" },
    "upcomingRaces": { "support": "observed", "probeStatus": "ok", "samples": 1, "lastSampleAt": "2026-09-05" },
    "activityHeartRate": { "support": "observed", "probeStatus": "ok", "samples": 20, "firstSampleAt": "2026-07-18", "lastSampleAt": "2026-08-19" },
    "cadence": { "support": "observed", "probeStatus": "ok", "samples": 20, "firstSampleAt": "2026-07-18", "lastSampleAt": "2026-08-19" },
    "calories": { "support": "observed", "probeStatus": "ok", "samples": 20, "firstSampleAt": "2026-07-18", "lastSampleAt": "2026-08-19" },
    "gps": { "support": "observed", "probeStatus": "ok", "samples": 20, "firstSampleAt": "2026-07-18", "lastSampleAt": "2026-08-19" },
    "elevation": { "support": "observed", "probeStatus": "ok", "samples": 20, "firstSampleAt": "2026-07-18", "lastSampleAt": "2026-08-19" },
    "temperature": { "support": "observed", "probeStatus": "ok", "samples": 20, "firstSampleAt": "2026-07-18", "lastSampleAt": "2026-08-19" },
    "strideLength": { "support": "observed", "probeStatus": "ok", "samples": 20, "firstSampleAt": "2026-07-18", "lastSampleAt": "2026-08-19" },
    "groundContactTime": { "support": "observed", "probeStatus": "ok", "samples": 20, "firstSampleAt": "2026-07-18", "lastSampleAt": "2026-08-19" },
    "groundContactBalance": { "support": "not_observed", "probeStatus": "ok", "samples": 0 },
    "verticalOscillation": { "support": "observed", "probeStatus": "ok", "samples": 20, "firstSampleAt": "2026-07-18", "lastSampleAt": "2026-08-19" },
    "verticalRatio": { "support": "observed", "probeStatus": "ok", "samples": 20, "firstSampleAt": "2026-07-18", "lastSampleAt": "2026-08-19" },
    "aerobicTrainingEffect": { "support": "observed", "probeStatus": "ok", "samples": 20, "firstSampleAt": "2026-07-18", "lastSampleAt": "2026-08-19" },
    "anaerobicTrainingEffect": { "support": "observed", "probeStatus": "ok", "samples": 20, "firstSampleAt": "2026-07-18", "lastSampleAt": "2026-08-19" },
    "runningPower": { "support": "not_observed", "probeStatus": "ok", "samples": 0 }
  }
}
