{
  "schemaVersion": 1,
  "generatedAt": "2026-08-28T00:00:00+00:00",
  "asOf": "2026-08-28",
  "device": {
    "name": "Forerunner 55",
    "firmware": "11.03"
  },
  "features": {
    "vo2max": { "support": "observed", "probeStatus": "ok", "samples": 26, "firstSampleAt": "2025-09-30", "lastSampleAt": "2026-03-12" },
    "fitnessAge": { "support": "not_observed", "probeStatus": "ok", "samples": 0 },
    "achievableFitnessAge": { "support": "not_observed", "probeStatus": "ok", "samples": 0 },
    "bmi": { "support": "not_observed", "probeStatus": "ok", "samples": 0 },
    "weight": { "support": "observed", "probeStatus": "ok", "samples": 1 },
    "height": { "support": "observed", "probeStatus": "ok", "samples": 1 },
    "heartRateZones": { "support": "observed", "probeStatus": "ok", "samples": 5 },
    "activityHeartRateZones": { "support": "observed", "probeStatus": "ok", "samples": 19, "firstSampleAt": "2025-09-05", "lastSampleAt": "2026-03-12" },
    "restingHeartRate": { "support": "observed", "probeStatus": "ok", "samples": 1 },
    "maxHeartRate": { "support": "observed", "probeStatus": "ok", "samples": 1 },
    "lactateThresholdHeartRate": { "support": "not_observed", "probeStatus": "ok", "samples": 0 },
    "thresholdPace": { "support": "not_observed", "probeStatus": "ok", "samples": 0 },
    "racePredictions": { "support": "observed", "probeStatus": "ok", "samples": 4, "firstSampleAt": "2026-05-07", "lastSampleAt": "2026-06-17" },
    "trainingStatus": { "support": "not_observed", "probeStatus": "ok", "samples": 0 },
    "trainingStatusWeekly": { "support": "not_observed", "probeStatus": "ok", "samples": 0 },
    "acuteTrainingLoad": { "support": "not_observed", "probeStatus": "ok", "samples": 0 },
    "chronicTrainingLoad": { "support": "not_observed", "probeStatus": "ok", "samples": 0 },
    "acwr": { "support": "not_observed", "probeStatus": "ok", "samples": 0 },
    "trainingLoadBalance": { "support": "not_observed", "probeStatus": "ok", "samples": 0 },
    "activeGear": { "support": "observed", "probeStatus": "ok", "samples": 1 },
    "retiredGear": { "support": "not_observed", "probeStatus": "ok", "samples": 0 },
    "trainingPlan": { "support": "not_observed", "probeStatus": "ok", "samples": 0 },
    "plannedWorkouts": { "support": "not_observed", "probeStatus": "ok", "samples": 0 },
    "upcomingRaces": { "support": "not_observed", "probeStatus": "ok", "samples": 0 },
    "activityHeartRate": { "support": "observed", "probeStatus": "ok", "samples": 20, "firstSampleAt": "2025-10-10", "lastSampleAt": "2026-03-12" },
    "cadence": { "support": "observed", "probeStatus": "ok", "samples": 20, "firstSampleAt": "2025-10-10", "lastSampleAt": "2026-03-12" },
    "calories": { "support": "observed", "probeStatus": "ok", "samples": 20, "firstSampleAt": "2025-10-10", "lastSampleAt": "2026-03-12" },
    "gps": { "support": "observed", "probeStatus": "ok", "samples": 20, "firstSampleAt": "2025-10-10", "lastSampleAt": "2026-03-12" },
    "elevation": { "support": "observed", "probeStatus": "ok", "samples": 20, "firstSampleAt": "2025-10-10", "lastSampleAt": "2026-03-12" },
    "temperature": { "support": "not_observed", "probeStatus": "ok", "samples": 0 },
    "strideLength": { "support": "not_observed", "probeStatus": "ok", "samples": 0 },
    "groundContactTime": { "support": "not_observed", "probeStatus": "ok", "samples": 0 },
    "groundContactBalance": { "support": "not_observed", "probeStatus": "ok", "samples": 0 },
    "verticalOscillation": { "support": "not_observed", "probeStatus": "ok", "samples": 0 },
    "verticalRatio": { "support": "not_observed", "probeStatus": "ok", "samples": 0 },
    "aerobicTrainingEffect": { "support": "not_observed", "probeStatus": "ok", "samples": 0 },
    "anaerobicTrainingEffect": { "support": "not_observed", "probeStatus": "ok", "samples": 0 },
    "runningPower": { "support": "not_observed", "probeStatus": "ok", "samples": 0 }
  }
}
